Role,Name,First_name,Age,Profile_photo,Profession,Specialties,Degrees,Description,Rates,Email,Phone_number,Password,Availability,Country,City,Postal_code,Address
2,Thompson,Sophia,42,,Entraîneur de fitness,"Musculation, Cardio, Entraînement en circuit","Certificat de Personal Trainer, Diplôme en Sciences du Sport","Passionné par la transformation physique et mentale de mes clients, je suis déterminé à les aider à atteindre leurs objectifs de remise en forme. Avec une approche personnalisée et motivante, je conçois des programmes d'entraînement efficaces adaptés à leurs besoins et à leurs capacités.","50€ par séance individuelle, 300€ pour un pack de 10 séances.",sophia.thompson@example.com,+33 6 12 34 56 78,9a0d4dd4ef0a0d0ece2dff945254860fd5ff88c9413058900ef5e0185bde6cd2,Vendredi: 12h-16h;,France,Paris,75001.0,12 Rue de Rivoli
2,Nguyen,Noah,26,,Entraîneur de boxe,"Boxe anglaise, Boxe française, Boxe thaïlandaise, Kickboxing","Diplôme d'Entraîneur de Boxe, Certification en Techniques de Combat, Formation en Prévention des Blessures","Fort de mon expérience sur le ring, je transmets ma passion pour la boxe en enseignant les techniques de combat et en cultivant la confiance en soi de mes élèves. Je les pousse à repousser leurs limites tout en développant leur agilité, leur force et leur discipline.",70€ par séances,noah.nguyen@example.com,+33 7 45 67 89 01,15b9dcfaa53283352a28535acc4d9c9761be92c80804201919ef9c20261882a3,"Vendredi: 12h-16h; Mardi: 10h-14h,18h-22h;",France,Paris,75010.0,7 Boulevard Saint-Germain
2,Patel,Olivia,48,,Entraîneur de course,"Course sur route, Course en montagne, Course de fond, Course de vitesse",Diplôme en Physiologie de l'Exercice,"Animé par la passion de la course à pied, je guide mes coureurs vers l'excellence en les aidant à améliorer leur technique, leur endurance et leur mental. Je les accompagne dans leur parcours, les motivant à relever chaque défi avec détermination et persévérance.",50€,olivia.patel@example.com,+33 6 56 78 90 12,32013bde00434049efe26c3d3a79de7d5d2439bc8499dff42ee950bb2be73661,"Mardi: 10h-14h,18h-22h; Dimanche: 8h-12h,14h-18h; Samedi: 14h-18h;",France,Paris,75020.0,15 Rue de la Paix
2,Williams,Michael,26,,Entraîneur de boxe,Kickboxing,Diplôme d'Entraîneur de Boxe,Mon but est de rendre le fitness accessible à tous en proposant des programmes adaptés aux besoins et aux capacités de chacun de mes clients.,70€ une séance,michael.williams@example.com,+33 6 12 34 56 78,9a0d4dd4ef0a0d0ece2dff945254860fd5ff88c9413058900ef5e0185bde6cd2,"Lundi: 8h-12h,16h-20h; Jeudi: 9h-13h,15h-19h; Mercredi: 8h-12h;",France,Rivière-sur-Mer,62100.0,12 Rue de Rivoli
2,Taylor,Sarah,29,,Entraîneur de course,Natation,Certification en Réhabilitation Physique,"En tant que coach de yoga, je guide mes élèves dans leur pratique pour améliorer leur souplesse, leur force et leur tranquillité d'esprit.",80€ par séance,sarah.taylor@example.com,+33 6 34 56 78 90,258e643fcdd070702afbe4f8b8da863d6f51856dcea4de512eae1d6352773429,"Mercredi: 8h-12h; Jeudi: 9h-13h,15h-19h; Dimanche: 8h-12h,14h-18h;",France,Paris,75010.0,7 Boulevard Saint-Germain
